2584,3187500,"CRANBERRY RIVER NEAR RICHWOOD, WV",207.415,5,38.29539032,-80.52647493,WV,4,yes,,yes,,54067,Nicholas,kana
2637,3213700,"TUG FORK AT WILLIAMSON, WV",2425.06,5,37.67315699,-82.28014077,KY,1,yes,,,,21195,Pike,
2679,3237280,Upper Twin Creek at McGaw OH,32.9542,5,38.64368745,-83.21573648,OH,3,yes,,,,39145,Scioto,
2680,3237500,Ohio Brush Creek near West Union OH,1003.208,5,38.80368382,-83.42102265,OH,3,yes,,yes,yes,39001,Adams,
2682,3238500,White Oak Creek near Georgetown OH,568.5038,5,38.85812494,-83.92853941,OH,3,yes,,,,39015,Brown,
2686,3241500,Massies Creek at Wilberforce OH,170.9145,5,39.72283771,-83.88270656,OH,1,yes,,,,39057,Greene,
2763,3280700,"CUTSHIN CREEK AT WOOTON, KY",158.2227,5,37.16509314,-83.30795645,KY,1,yes,,,,21131,Leslie,
2767,3281100,"GOOSE CREEK AT MANCHESTER, KY",422.7237,5,37.15203405,-83.7601974,KY,1,yes,,,,21051,Clay,
2768,3281500,"SOUTH FORK KENTUCKY RIVER AT BOONEVILLE, KY",1838.22,5,37.47981018,-83.67519226,KY,3,yes,,yes,,21189,Owsley,
2782,3285000,"DIX RIVER NEAR DANVILLE, KY",822.3408,5,37.64202341,-84.66077678,KY,1,yes,,yes,yes,21079,Garrard,
2802,3291780,"INDIAN-KENTUCK CREEK NR CANAAN, IND.",71.4105,5,38.8781136,-85.25717882,IN,1,yes,,,,18077,Jefferson,
2834,3300400,"BEECH FORK AT MAUD, KY",1128.578,5,37.83283985,-85.29606856,KY,1,yes,,,,21229,Washington,
2925,3338780,"NORTH FORK VERMILION RIVER NEAR BISMARCK, IL",691.5555,5,40.265314,-87.642799,IL,1,yes,,,,17183,Vermilion,
2932,3340800,BIG RACCOON CREEK NEAR FINCASTLE IND,357.6537,5,39.81254461,-86.95389884,IN,3,yes,,yes,,18133,Putnam,
2945,3346000,"NORTH FORK EMBARRAS RIVER NEAR OBLONG, IL",814.6935,5,39.01004218,-87.9455882,IL,3,yes,,yes,yes,17033,Crawford,
2991,3357350,"PLUM CREEK NEAR BAINBRIDGE, IND.",7.7535,5,39.76171297,-86.72945046,IN,1,yes,,,,18133,Putnam,
3010,3364500,"CLIFTY CREEK AT HARTSVILLE, IN",237.0879,5,39.27477321,-85.70164687,IN,1,yes,,,,18005,Bartholomew,
3014,3366500,"MUSCATATUCK RIVER NEAR DEPUTY, IN",755.2151,5,38.80422346,-85.67385502,IN,4,yes,,,,18077,Jefferson,whmi
3015,3368000,"BRUSH CREEK NEAR NEBRASKA, IN",29.7216,5,39.07033129,-85.48607656,IN,1,yes,,,,18079,Jennings,
3044,3384450,"LUSK CREEK NEAR EDDYVILLE, IL",111.1266,5,37.4722725,-88.54726928,IL,1,yes,,,,17151,Pope,
3105,3439000,"FRENCH BROAD RIVER AT ROSMAN, NC",178.6674,6,35.14333333,-82.82472222,NC,4,yes,,,,37175,Transylvania,tenn
3115,344894205,"NORTH FORK SWANNANOA RIVER NEAR WALKERTOWN, NC",38.6046,6,35.683333,-82.333056,NC,1,yes,,,,37021,Buncombe,
3116,3450000,"BEETREE CREEK NEAR SWANNANOA, NC",14.0805,6,35.65305556,-82.40527778,NC,1,yes,,yes,,37021,Buncombe,
3123,3455500,"W F PIGEON R ABOVE LAKE LOGAN NR HAZELWOOD, NC",72.9522,6,35.39611111,-82.9375,NC,3,yes,,yes,,37087,Haywood,
3127,3456500,"EAST FORK PIGEON RIVER NEAR CANTON, NC",133.4268,6,35.46166667,-82.86972222,NC,1,yes,,yes,,37087,Haywood,
3133,3460000,"CATALOOCHEE CREEK NEAR CATALOOCHEE, NC",127.019,6,35.6675,-83.07361111,NC,1,yes,yes,yes,yes,37087,Haywood,
3137,3463300,"SOUTH TOE RIVER NEAR CELO, NC",112.1589,6,35.83150735,-82.18428691,NC,1,yes,,yes,,37199,Yancey,
3149,3471500,"S F HOLSTON RIVER AT RIVERSIDE NR CHILHOWIE, VA",198.1611,6,36.76039313,-81.63122929,VA,1,yes,,,,51173,Smyth,
3150,3473000,"S F HOLSTON RIVER NEAR DAMASCUS, VA",784.8126,6,36.65178127,-81.84401023,VA,1,yes,,yes,,51191,Washington,
3155,3479000,"WATAUGA RIVER NEAR SUGAR GROVE, NC",235.6011,6,36.23916667,-81.82222222,NC,1,yes,,yes,yes,37189,Watauga,
3161,3488000,"N F HOLSTON RIVER NEAR SALTVILLE, VA",578.206,6,36.89678115,-81.74622934,VA,4,yes,,yes,,51173,Smyth,tenn
3171,3498500,"LITTLE RIVER NEAR MARYVILLE, TN",696.7582,6,35.78562063,-83.88460359,TN,4,yes,,,,47009,Blount,tenn
3174,3500000,"LITTLE TENNESSEE RIVER NEAR PRENTISS, NC",361.1439,6,35.15,-83.37972222,NC,1,yes,,yes,yes,37113,Macon,
3175,3500240,"CARTOOGECHAYE CREEK NEAR FRANKLIN, NC",145.8639,6,35.15888889,-83.39416667,NC,1,yes,,yes,,37113,Macon,
3180,3504000,"NANTAHALA RIVER NEAR RAINBOW SPRINGS, NC",134.5167,6,35.1275,-83.61861111,NC,1,yes,,yes,,37043,Clay,
3246,3574500,PAINT ROCK RIVER NEAR WOODVILLE AL,813.8025,6,34.62425473,-86.30637373,AL,3,yes,,yes,yes,1071,Jackson,
3271,3592718,"LITTLE YELLOW CREEK EAST NR BURNSVILLE, MS",66.9897,6,34.83555556,-88.28805556,MS,1,yes,,,yes,28141,Tishomingo,
3275,3597590,"WARTRACE CREEK BELOW COUNTY ROAD AT WARTRACE, TN",92.943,6,35.527295,-86.340271,TN,1,yes,,,,47003,Bedford,
3288,3604000,"BUFFALO RIVER NEAR FLAT WOODS, TN",1163.026,6,35.49590598,-87.83280366,TN,4,yes,,yes,yes,47135,Perry,tenn
3300,4015330,"KNIFE RIVER NEAR TWO HARBORS, MN",224.3547,4,46.94688005,-91.79240133,MN,1,yes,,,,27137,St Louis,
3309,4024430,"NEMADJI RIVER NEAR SOUTH SUPERIOR, WI",1091.25,4,46.63327388,-92.09408026,WI,1,yes,,,,55031,Douglas,
3311,4027000,"BAD RIVER NEAR ODANAH, WI",1619.847,4,46.48661442,-90.69629696,WI,3,yes,,yes,,55003,Ashland,
3326,4040500,"STURGEON RIVER NEAR SIDNAW, MI",419.8266,4,46.58410589,-88.57596973,MI,3,yes,,yes,yes,26013,Baraga,
3330,4043050,"TRAP ROCK RIVER NEAR LAKE LINDEN, MI",76.6224,4,47.22853637,-88.38539282,MI,1,yes,,,,26061,Houghton,
3338,4045500,"TAHQUAMENON RIVER NEAR PARADISE, MI",1909.592,4,46.57501478,-85.26955476,MI,3,yes,,yes,yes,26095,Luce,
3342,4056500,"MANISTIQUE RIVER NEAR MANISTIQUE, MI",2945.888,4,46.03052857,-86.16124902,MI,1,yes,,yes,,26153,Schoolcraft,
3344,4057510,"STURGEON RIVER NEAR NAHMA JUNCTION, MI",473.5728,4,45.94302355,-86.70569966,MI,1,yes,,,yes,26041,Delta,
3345,4057800,"MIDDLE BRANCH ESCANABA RIVER AT HUMBOLDT, MI",115.8705,4,46.49910267,-87.88652383,MI,1,yes,,,,26103,Marquette,
3351,4059500,"FORD RIVER NEAR HYDE, MI",1184.366,4,45.75552297,-87.2015238,MI,3,yes,,yes,,26041,Delta,
3362,4063700,"POPPLE RIVER NEAR FENCE, WI",362.5712,4,45.7635697,-88.4631785,WI,4,yes,yes,yes,,55037,Florence,wmic
3389,4074950,"WOLF RIVER AT LANGLADE, WI",1205.531,4,45.18997026,-88.73343978,WI,1,yes,,,yes,55067,Langlade,
3460,4105700,"AUGUSTA CREEK NEAR AUGUSTA, MI",98.0415,4,42.35337341,-85.35388936,MI,1,yes,,,,26077,Kalamazoo,
3483,4115265,"FISH CREEK NEAR CRYSTAL, MI",95.77711,4,43.2497545,-84.9811245,MI,1,yes,,,,26117,Montcalm,
3499,4122200,"WHITE RIVER NEAR WHITEHALL, MI",1048.284,4,43.46417856,-86.23256675,MI,1,yes,,,yes,26121,Presque Isle,
3500,4122500,"PERE MARQUETTE RIVER AT SCOTTVILLE, MI",1769.188,4,43.94500632,-86.2786896,MI,1,yes,,,,26105,Mason,
3503,4124000,"MANISTEE RIVER NEAR SHERMAN, MI",2243.628,4,44.43639239,-85.69867924,MI,3,yes,,,,26165,Wexford,
3514,4127918,"PINE RIVER NEAR RUDYARD, MI",548.2863,4,46.18585053,-84.59782625,MI,1,yes,,,,26033,Chippewa,
3515,4127997,"STURGEON RIVER AT WOLVERINE, MI",487.1601,4,45.27445746,-84.60003148,MI,1,yes,,,,26031,Cheboygan,
3579,4161580,"STONY CREEK NEAR ROMEO, MI",64.3104,4,42.8008637,-83.0902121,MI,1,yes,,,,26099,Macomb,
3624,4185000,Tiffin River at Stryker OH,1064.001,4,41.50449567,-84.42967186,OH,1,yes,,,yes,39171,Williams,
3640,4196800,Tymochtee Creek at Crawford OH,608.067,4,40.92283322,-83.34881158,OH,1,yes,,,,39175,Wyandot,
3642,4197100,Honey Creek at Melmore OH,388.2105,4,41.022278,-83.10963818,OH,1,yes,,,,39147,Seneca,
3643,4197170,Rock Creek at Tiffin OH,95.20831,4,41.11366592,-83.16825212,OH,1,yes,,,,39147,Seneca,
3666,4213000,Conneaut Creek at Conneaut OH,455.2974,4,41.92699898,-80.60396593,OH,3,yes,,yes,yes,39007,Ashtabula,
3668,4213075,"Brandy Run near Girard, PA",11.6514,4,41.9920003,-80.2911737,PA,1,yes,,,,42049,Erie,
3674,4216418,TONAWANDA CREEK AT ATTICA NY,196.4727,4,42.86394893,-78.28362793,NY,1,yes,,,,36121,Wyoming,
3682,4221000,GENESEE RIVER AT WELLSVILLE NY,750.879,4,42.12229032,-77.95722459,NY,1,yes,,yes,yes,36003,Allegany,
3685,4224775,CANASERAGA CREEK ABOVE DANSVILLE NY,231.8445,4,42.5356226,-77.70416132,NY,1,yes,,,,36051,Livingston,
3702,4233000,CAYUGA INLET NEAR ITHACA NY,91.8999,4,42.3931287,-76.5449429,NY,1,yes,,,,36109,Tompkins,
3731,4256000,INDEPENDENCE RIVER AT DONNATTSBURG NY,232.4457,4,43.74729136,-75.33434745,NY,3,yes,,yes,yes,36049,Lewis,
3786,4296000,"BLACK RIVER AT COVENTRY, VT",302.1894,1,44.86893639,-72.2701042,VT,1,yes,,yes,yes,50019,Orleans,
3809,5056000,"SHEYENNE RIVER NR WARWICK, ND",4862.024,9,47.80555344,-98.71621718,ND,4,yes,,yes,,38027,Eddy,redn
3812,5057000,"SHEYENNE RIVER NR COOPERSTOWN, ND",7582.457,9,47.43277097,-98.02759541,ND,1,yes,,yes,yes,38039,Griggs,
3813,5057200,"BALDHILL CREEK NR DAZEY, ND",1897.332,9,47.22915623,-98.12481891,ND,1,yes,,yes,,38003,Barnes,
3828,5062500,"WILD RICE RIVER AT TWIN VALLEY, MN",2407.047,9,47.26662917,-96.24478028,MN,4,yes,,yes,,27107,Norman,redn
3849,5087500,"MIDDLE RIVER AT ARGYLE, MN",600.8184,9,48.34108857,-96.81811688,MN,1,yes,,,,27089,Marshall,
3862,5120500,"WINTERING RIVER NR KARLSRUHE, ND",1509.827,9,48.13833739,-100.5398623,ND,1,yes,,yes,,38049,Mchenry,
3863,5123400,"WILLOW CREEK NR WILLOW CITY, ND",3206.101,9,48.58888752,-100.4420787,ND,1,yes,,yes,yes,38049,Mchenry,
3870,5129115,"VERMILION RIVER NR CRANE LAKE, MN",2357.585,9,48.26462833,-92.56599361,MN,1,yes,,,,27137,St Louis,
3873,5131500,"LITTLE FORK RIVER AT LITTLEFORK, MN",4383.507,9,48.39577639,-93.54932667,MN,3,yes,,yes,,27071,Koochiching,
3905,5291000,"WHETSTONE RIVER NEAR BIG STONE CITY, SD",1046.776,7,45.29163167,-96.48755694,SD,1,yes,,yes,yes,46051,Grant,
3950,5362000,"JUMP RIVER AT SHELDON, WI",1477.292,7,45.30802638,-90.95652506,WI,3,yes,,yes,,55107,Rusk,
3985,5393500,"SPIRIT RIVER AT SPIRIT FALLS, WI",220.4352,7,45.44913202,-89.97931083,WI,3,yes,,yes,,55069,Lincoln,
3990,5399500,"BIG EAU PLEINE RIVER AT STRATFORD, WI",576.3033,7,44.82190984,-90.07957543,WI,1,yes,,yes,yes,55073,Marathon,
4001,5408000,"KICKAPOO RIVER AT LA FARGE, WI",689.3334,7,43.57414037,-90.64318611,WI,1,yes,,yes,yes,55123,Vernon,
4007,5412500,"Turkey River at Garber, IA",3858.214,7,42.73998843,-91.26179908,IA,3,yes,,yes,,19043,Clayton,
4008,5413500,"GRANT RIVER AT BURTON, WI",695.3256,7,42.72027114,-90.81929352,WI,3,yes,,yes,yes,55043,Grant,
4009,5414000,"PLATTE RIVER NEAR ROCKVILLE, WI",370.7901,7,42.73110419,-90.64040529,WI,3,yes,,yes,,55043,Grant,
4071,5444000,"ELKHORN CREEK NEAR PENROSE, IL",376.3512,7,41.90280739,-89.69622298,IL,1,yes,,yes,yes,17195,Whiteside,
4087,5454000,"Rapid Creek near Iowa City, IA",65.3814,7,41.70001652,-91.48766843,IA,1,yes,,,,19103,Johnson,
4099,5458000,"Little Cedar River near Ionia, IA",776.7648,7,43.03328014,-92.50354351,IA,3,yes,,yes,,19037,Chickasaw,
4115,5466500,"EDWARDS RIVER NEAR NEW BOSTON, IL",1151.567,7,41.18697738,-90.96736632,IL,1,yes,,,,17131,Mercer,
4161,5487980,"White Breast Creek near Dallas, IA",882.7254,7,41.24688494,-93.26606966,IA,1,yes,,,,19125,Marion,
4163,5488200,"English Creek near Knoxville, IA",234.2088,7,41.30055336,-93.04548051,IA,1,yes,,,,19125,Marion,
4165,5489000,"Cedar Creek near Bussey, IA",964.7559,7,41.21900212,-92.90853319,IA,1,yes,,yes,,19125,Marion,
4169,5495000,"Fox River at Wayland, MO",1027.552,7,40.39240833,-91.597875,MO,1,yes,,yes,,29045,Clark,
4170,5495500,"BEAR CREEK NEAR MARCELLINE, IL",905.5557,7,40.14282371,-91.33737008,IL,3,yes,,,yes,17001,Adams,
4178,5501000,"North River at Palmyra, MO",922.8276,7,39.81799167,-91.5177,MO,1,yes,,yes,yes,29127,Marion,
4184,5503800,"Crooked Creek near Paris, MO",212.6412,7,39.58482778,-91.99348889,MO,1,yes,,,,29137,Monroe,
4193,5507600,"Lick Creek at Perry, MO",275.3757,7,39.43142963,-91.67627075,MO,1,yes,,,,29173,Ralls,
4196,5508805,"Spencer Cr. bl Plum Cr. nr Frankford, MO",536.4018,7,39.52046389,-91.34275,MO,1,yes,,,,29173,Ralls,
4199,5514500,"CUIVRE RIVER NEAR TROY, MO",2407.411,7,39.00880278,-90.97753611,MO,1,yes,,yes,,29113,Lincoln,
4219,5525500,"SUGAR CREEK AT MILFORD, IL",1158.759,7,40.6300362,-87.72391809,IL,4,yes,,,,17075,Iroquois,uirb
4291,5556500,"BIG BUREAU CREEK AT PRINCETON, IL",505.0946,7,41.36586984,-89.49842655,IL,4,yes,,yes,,17011,Bureau,lirb
4331,5584500,"LA MOINE RIVER AT COLMAR, IL",1695.671,7,40.33032166,-90.89624511,IL,4,yes,,,,17109,Mcdonough,lirb
4332,5585000,"LA MOINE RIVER AT RIPLEY, IL",3354.608,7,40.02477041,-90.63179466,IL,1,yes,,yes,,17009,Brown,
4346,5591550,"WHITLEY CREEK NEAR ALLENVILLE, IL",96.20551,7,39.50670031,-88.52755468,IL,1,yes,,,,17139,Moultrie,
4349,5592050,"ROBINSON CREEK NEAR SHELBYVILLE, IL",254.1213,7,39.40587344,-88.89646283,IL,1,yes,,,,17173,Shelby,
4353,5592575,"HICKORY CREEK NEAR BROWNSTOWN, IL",115.2504,7,38.93699,-88.952838,IL,1,yes,,,,17051,Fayette,
4358,5593575,"LITTLE CROOKED CREEK NEAR NEW MINDEN, IL",217.6731,7,38.44171643,-89.41675104,IL,1,yes,,,,17189,Washington,
4360,5593900,"EAST FORK SHOAL CREEK NEAR COFFEEN, IL",145.4472,7,39.14893485,-89.35230484,IL,1,yes,,,yes,17135,Montgomery,
4369,5595730,"RAYSE CREEK NEAR WALTONVILLE, IL",236.7603,7,38.25393889,-89.03979328,IL,1,yes,,,yes,17081,Jefferson,
4403,6037500,Madison River near West Yellowstone MT,1126.247,10U,44.6568722,-111.0682742,MT,1,yes,,yes,yes,30031,Gallatin,
4408,6043500,Gallatin River near Gallatin Gateway MT,2120.42,10U,45.4974286,-111.2705108,MT,1,yes,,yes,,30031,Gallatin,
4465,6154410,Little Peoples Creek near Hays MT,33.4053,10U,47.9661044,-108.6607103,MT,1,yes,,,,30005,Blaine,
4477,6188000,"LAMAR RIVER NR TOWER FALLS RANGER STATION, YNP",1730.28,10U,44.92771567,-110.3938099,WY,1,yes,,yes,,56029,Park,
4479,6191000,Gardner River near Mammoth YNP,513.8847,10U,44.99243556,-110.6913211,MT,1,yes,,yes,,30067,Park,
4480,6191500,Yellowstone River at Corwin Springs MT,6783.593,10U,45.1118797,-110.7943814,MT,4,yes,,yes,,30067,Park,yell
4502,6221400,"DINWOODY CREEK ABOVE LAKES, NEAR BURRIS, WYO.",227.8809,10U,43.34551138,-109.4101431,WY,1,yes,,yes,,56013,Fremont,
4504,6224000,"BULL LAKE CREEK ABOVE BULL LAKE, WY",484.8579,10U,43.17690132,-109.2029109,WY,1,yes,,yes,,56013,Fremont,
4535,6278300,"SHELL CREEK ABOVE SHELL CREEK RESERVOIR, WY",58.851,10U,44.50801953,-107.4036886,WY,1,yes,,yes,,56003,Big Horn,
4539,6280300,"SOUTH FORK SHOSHONE RIVER NEAR VALLEY, WY",793.953,10U,44.20828238,-109.5548879,WY,1,yes,,yes,,56029,Park,
4547,6289000,Little Bighorn River at State Line nr Wyola MT,471.2687,10U,45.0069097,-107.6150953,MT,4,yes,,yes,yes,30003,Big Horn,yell
4552,6291500,Lodge Grass Cr ab Willow C Div nr Wyola MT,217.9557,10U,45.12644468,-107.6005448,MT,1,yes,,,,30003,Big Horn,
4578,6309200,"MIDDLE FORK POWDER RIVER NEAR BARNUM, WY",117.5427,10U,43.57773999,-107.1383995,WY,1,yes,,,,56043,Washakie,
4580,6311000,"NORTH FORK POWDER RIVER NEAR HAZELTON, WY",61.2315,10U,44.02774228,-107.0808955,WY,1,yes,,yes,yes,56019,Johnson,
4607,6332515,"BEAR DEN CREEK NR MANDAREE, ND",191.4867,10U,47.78723694,-102.7685256,ND,1,yes,,yes,yes,38053,Mckenzie,
4618,6339100,"KNIFE RIVER AT MANNING, ND",529.1415,10U,47.23612594,-102.7699074,ND,1,yes,,yes,,38025,Dunn,
4619,6339500,"KNIFE RIVER NR GOLDEN VALLEY, ND",3171.457,10U,47.15445301,-102.0598921,ND,1,yes,,yes,,38057,Mercer,
4628,6344600,"GREEN RIVER NR NEW HRADEC, ND",402.4971,10U,47.02779158,-103.0532355,ND,3,yes,,yes,,38007,Billings,
4642,6350000,"CANNONBALL RIVER AT REGENT, ND",1501.049,10U,46.42667116,-102.5518303,ND,3,yes,,yes,,38041,Hettinger,
4645,6352000,"CEDAR CREEK NR HAYNES, ND",1441.832,10U,46.15417025,-102.4740467,ND,1,yes,,yes,,38001,Adams,
4647,6353000,"CEDAR CREEK NR RALEIGH, ND",4526.511,10U,46.09166988,-101.333742,ND,3,yes,,yes,,38085,Sioux,
4648,6354000,"CANNONBALL RIVER AT BREIEN, ND",10598.19,10U,46.37611111,-100.9344444,ND,1,yes,,yes,,38059,Morton,
4659,6360500,MOREAU R NEAR WHITEHORSE SD,12654.96,10U,45.25581712,-100.8429214,SD,1,yes,,,yes,46041,Dewey,
4677,6404000,BATTLE CR NEAR KEYSTONE SD,151.8273,10U,43.87248893,-103.3365779,SD,1,yes,,,,46103,Pennington,
4679,6406000,BATTLE CR AT HERMOSA SD,436.3389,10U,43.82804586,-103.1960211,SD,1,yes,,,,46033,Custer,
4684,6408700,RHOADS FORK NEAR ROCHFORD SD,20.7954,10U,44.13664933,-103.8585355,SD,1,yes,,,,46103,Pennington,
4685,6409000,CASTLE CR ABOVE DEERFIELD RES NEAR HILL CITY SD,205.3285,10U,44.01359238,-103.8304784,SD,3,yes,,yes,yes,46103,Pennington,
4693,6422500,BOXELDER CR NEAR NEMO SD,243.9207,10U,44.14387557,-103.4549107,SD,1,yes,,,,46093,Meade,
4714,6431500,SPEARFISH CR AT SPEARFISH SD,427.1049,10U,44.48248388,-103.861592,SD,1,yes,,yes,yes,46081,Lawrence,
4729,6440200,"SOUTH FORK BAD R NEAR COTTONWOOD,SD",649.1916,10U,43.968879,-101.76709,SD,1,yes,,,yes,46071,Jackson,
4731,6441500,BAD R NEAR FORT PIERRE SD,8152.545,10U,44.32664897,-100.3843003,SD,1,yes,,yes,,46117,Stanley,
4740,6447000,WHITE R NEAR KADOKA SD,12849.71,10U,43.75249491,-101.5248665,SD,1,yes,,,yes,46071,Jackson,
4743,6447500,LITTLE WHITE R NEAR MARTIN SD,826.6077,10U,43.16666553,-101.6301489,SD,1,yes,,,yes,46007,Bennett,
4749,6450500,LITTLE WHITE R BELOW WHITE RIVER SD,4111.272,10U,43.60138549,-100.7498608,SD,1,yes,,,,46095,Mellette,
4750,6452000,WHITE R NEAR OACOMA SD,25791.04,10U,43.74832745,-99.5564948,SD,1,yes,,yes,,46085,Lyman,
4754,6453600,"PONCA CREEK AT VERDEL, NEBR.",2101.42,10L,42.81099444,-98.17585833,NE,1,yes,,,,31107,Knox,
4767,6464500,KEYA PAHA R AT WEWELA SD,2914.043,10L,43.02889277,-99.78067095,SD,3,yes,,yes,yes,46123,Tripp,
4775,6468170,"JAMES RIVER NR GRACE CITY, ND",2809.098,10U,47.5580525,-98.862885,ND,1,yes,,yes,yes,38031,Foster,
4776,6468250,"JAMES RIVER ABOVE ARROWWOOD LAKE NR KENSAL, ND",3242.608,10U,47.39971891,-98.79760572,ND,1,yes,,,,38031,Foster,
4781,6470800,"BEAR CREEK NR OAKES, ND",1071.145,10U,46.22524393,-98.0717676,ND,1,yes,,,,38021,Dickey,
4799,6477500,FIRESTEEL CR NEAR MOUNT VERNON SD,1512.444,10U,43.7764,-98.24567222,SD,1,yes,,,,46035,Davison,
4805,6479215,BIG SIOUX RIVER NR FLORENCE SD,175.2822,10L,45.18079549,-97.1861904,SD,1,yes,,,,46051,Grant,
4806,6479438,BIG SIOUX R NEAR WATERTOWN SD,951.9129,10L,45.0060753,-97.1650756,SD,1,yes,,,,46029,Codington,
4826,6601000,"OMAHA CR AT HOMER, NEBR",450.1989,10L,42.32158056,-96.48768333,NE,1,yes,,,,31043,Dakota,
4841,6614800,"MICHIGAN RIVER NEAR CAMERON PASS, CO.",4.0284,10L,40.49609409,-105.865012,CO,1,yes,,,yes,8057,Jackson,
4845,6622700,"NORTH BRUSH CREEK NEAR SARATOGA, WY",98.703,10L,41.37024471,-106.5205815,WY,1,yes,,yes,,56007,Carbon,
4847,6623800,"ENCAMPMENT RIVER AB HOG PARK CR, NR ENCAMPMENT, WY",187.6617,10L,41.0235791,-106.824766,WY,1,yes,yes,yes,,56007,Carbon,
4853,6632400,"ROCK CREEK AB KING CANYON CANAL, NR ARLINGTON, WY",162.9855,10L,41.58524549,-106.2227909,WY,1,yes,,yes,,56007,Carbon,
4952,6746095,"JOE WRIGHT CREEK ABOVE JOE WRIGHT RESERVOIR, CO.",8.9046,10L,40.53998222,-105.88279,CO,1,yes,,,,8069,Larimer,
4979,6775500,"MIDDLE LOUP RIVER AT DUNNING, NEBR.",5459.764,10L,41.83124444,-100.1007778,NE,1,yes,,,,31009,Blaine,
4983,6784000,"SOUTH LOUP R AT ST. MICHAEL, NEBR.",6019.745,10L,41.03244444,-98.74053333,NE,4,yes,,,,31019,Buffalo,cnbr
5018,6803510,"LITTLE SALT CREEK NEAR LINCOLN, NEBR.",113.2785,10L,40.89311389,-96.68155278,NE,1,yes,,,,31109,Lancaster,
5021,6803530,"ROCK CREEK NEAR CERESCO, NEBR.",309.7458,10L,41.01569722,-96.54428333,NE,1,yes,,,,31109,Lancaster,
5038,6814000,"TURKEY C NR SENECA, KS",713.826,10L,39.94777732,-96.10861492,KS,1,yes,,yes,,20131,Nemaha,
5089,6846500,"BEAVER C AT CEDAR BLUFFS, KS",4357.758,10L,39.98500557,-100.560148,KS,3,yes,,,,20039,Decatur,
5092,6847900,"PRAIRIE DOG C AB KEITH SEBELIUS LAKE, KS",1536.188,10L,39.76984922,-100.1007792,KS,1,yes,,,,20137,Norton,
5098,6853800,"WHITE ROCK C NR BURR OAK, KS",589.4253,10L,39.89924944,-98.25042485,KS,3,yes,,yes,yes,20089,Jewell,
5132,6876700,"SALT C NR ADA, KS",1056.442,10L,39.13906876,-97.83695994,KS,3,yes,,yes,,20143,Ottawa,
5135,6878000,"CHAPMAN C NR CHAPMAN, KS",776.4183,10L,39.031109,-97.0402922,KS,1,yes,,yes,yes,20041,Dickinson,
5137,6879650,"KINGS C NR MANHATTAN, KS",11.5065,10L,39.10194797,-96.59521413,KS,1,yes,yes,yes,yes,20161,Riley,
5154,6885500,"BLACK VERMILLION R NR FRANKFORT, KS",1062.869,10L,39.68192405,-96.44289431,KS,1,yes,,yes,,20117,Marshall,
5157,6888500,"MILL C NR PAXICO, KS",842.346,10L,39.06265453,-96.15025179,KS,1,yes,,yes,,20197,Wabaunsee,
5162,6889200,"SOLDIER C NR DELIA, KS",385.6599,10L,39.23833024,-95.88859924,KS,5,yes,,yes,,20085,Jackson,
5163,6889500,"SOLDIER C NR TOPEKA, KS",748.5822,10L,39.09938003,-95.72495226,KS,3,yes,,yes,,20177,Shawnee,
5169,6892000,"STRANGER C NR TONGANOXIE, KS",1092.723,10L,39.11632734,-95.01088111,KS,1,yes,,yes,,20103,Leavenworth,
5206,6903400,"Chariton River near Chariton, IA",481.4154,10L,40.95189005,-93.25984769,IA,1,yes,,,,19117,Lucas,
5217,6906800,"Lamine River near Otterville, MO",1414.753,10L,38.70225,-92.9788333,MO,1,yes,,,,29053,Cooper,
5225,6910800,"MARAIS DES CYGNES R NR READING, KS",444.5973,10L,38.56700524,-95.96163206,KS,1,yes,,,,20111,Lyon,
5229,6911900,"DRAGOON C NR BURLINGAME, KS",293.0553,10L,38.71069034,-95.8360288,KS,1,yes,,,,20139,Osage,
5241,6917000,"L OSAGE R AT FULTON, KS",765.7839,10L,38.01896828,-94.71366829,KS,3,yes,,yes,,20011,Bourbon,
5251,6918460,"Turnback Creek above Greenfield, MO",650.6892,10L,37.40236944,-93.80202778,MO,1,yes,,,,29057,Dade,
5256,6919500,"Cedar Creek near Pleasant View, MO",1069.424,10L,37.83420277,-93.87549183,MO,1,yes,,,,29039,Cedar,
5259,6921070,"Pomme de Terre River near Polk, MO",712.586,10L,37.68265278,-93.37033333,MO,4,yes,,,,29167,Polk,ozrk
5260,6921200,"Lindley Creek near Polk, MO",323.6193,10L,37.75046667,-93.26618333,MO,1,yes,,,yes,29167,Polk,
5284,6934000,"Gasconade River near Rich Fountain, MO",8264.9,10L,38.38880833,-91.81988889,MO,1,yes,,,,29151,Osage,
5315,7014500,"Meramec River near Sullivan, MO",3845.5,7,38.15853056,-91.10845833,MO,1,yes,,,yes,29055,Crawford,
5409,7056000,"Buffalo River near St. Joe, AR",2149.364,11,35.983175,-92.74755278,AR,4,yes,,yes,,5129,Searcy,ozrk
5414,7057500,"North Fork River near Tecumseh, MO",1456.436,11,36.62303333,-92.248125,MO,1,yes,,yes,,29153,Ozark,
5418,7060710,"North Sylamore Creek near Fifty Six, AR",150.0277,11,35.99535053,-92.21265464,AR,4,yes,yes,yes,,5137,Stone,ozrk
5436,7066000,"Jacks Fork at Eminence, MO",1053.496,11,37.15408056,-91.35816111,MO,1,yes,,,yes,29203,Shannon,
5438,7067000,"Current River at Van Buren, MO",4349.011,11,36.99137778,-91.01351111,MO,4,yes,,yes,,29035,Carter,ozrk
5439,7068000,"Current River at Doniphan, MO",5318.585,11,36.62200294,-90.84762251,MO,1,yes,,yes,,29181,Ripley,
5445,7071500,"Eleven Point River near Bardley, MO",2023.769,11,36.64868056,-91.20081944,MO,1,yes,,yes,,29149,Oregon,
5462,7083000,"HALFMOON CREEK NEAR MALTA, CO.",60.76139,11,39.17221259,-106.3891926,CO,1,yes,yes,yes,yes,8065,Lake,
5507,7105945,"ROCK CREEK ABOVE FORT CARSON RESERVATION, CO.",17.4771,11,38.70749302,-104.8466403,CO,1,yes,,,,8041,El Paso,
5547,7142300,"RATTLESNAKE C NR MACKSVILLE, KS",1819.941,11,37.87159374,-98.8761373,KS,1,yes,,,,20185,Stafford,
5557,7144780,"NF NINNESCAH R AB CHENEY RE, KS",2078.906,11,37.86260737,-98.01385325,KS,1,yes,,yes,,20155,Reno,
5562,7145700,"SLATE C AT WELLINGTON, KS",399.8106,11,37.2495504,-97.40389581,KS,1,yes,,,,20191,Sumner,
5566,7148400,"Salt Fork Arkansas River nr Alva, OK",2544.504,11,36.81503056,-98.6481394,OK,1,yes,,,,40151,Woods,
5567,7149000,"MEDICINE LODGE R NR KIOWA, KS",2291.199,11,37.03920157,-98.47021478,KS,1,yes,,yes,,20007,Barber,
5570,7151500,"CHIKASKIA R NR CORBIN, KS",2108.996,11,37.12891226,-97.60143889,KS,1,yes,,yes,yes,20191,Sumner,
5599,7167500,"OTTER C AT CLIMAX, KS",319.6179,11,37.70820958,-96.22360237,KS,1,yes,,yes,,20073,Greenwood,
5629,7180500,"CEDAR C NR CEDAR POINT, KS",275.5053,11,38.19645062,-96.82457873,KS,1,yes,,yes,yes,20017,Chase,
5635,7184000,"LIGHTNING C NR MCCUNE, KS",510.8391,11,37.28125445,-95.03266782,KS,3,yes,,yes,,20021,Cherokee,
5669,7195800,"Flint Creek at Springtown, AR",38.2347,11,36.25548056,-94.43394167,AR,1,yes,,,,5007,Benton,
5674,7196900,"Baron Fork at Dutch Mills, AR",106.3521,11,35.88008235,-94.48660625,AR,1,yes,,,,5143,Washington,
5675,7197000,"Baron Fork at Eldon, OK",808.4485,11,35.92120028,-94.8385633,OK,4,yes,,yes,yes,40021,Cherokee,ozrk
5686,7208500,"RAYADO CREEK NEAR CIMARRON, NM",159.2235,11,36.37225823,-104.9700026,NM,1,yes,,yes,,35007,Colfax,
5697,7226500,"UTE CREEK NEAR LOGAN, NM",5242.753,11,35.43838224,-103.5257944,NM,1,yes,,,yes,35021,Harding,
5759,7261000,"Cadron Creek near Guy, AR",445.8141,11,35.2988,-92.40393056,AR,3,yes,,yes,yes,5045,Faulkner,
5764,7263295,"Maumelle River at Williams Junction, AR",119.0277,11,34.876201,-92.774612,AR,1,yes,,,,5105,Perry,
5802,7290650,"BAYOU PIERRE NR WILLOWS, MS",1688.728,8,32.01777778,-90.87694444,MS,3,yes,,yes,,28021,Claiborne,
5803,7291000,"HOMOCHITTO RIVER AT EDDICETON, MS",479.2959,8,31.50305556,-90.7775,MS,3,yes,,yes,yes,28037,Franklin,
5804,7292500,"HOMOCHITTO RIVER AT ROSETTA, MS",2073.093,8,31.32472222,-91.10944444,MS,3,yes,,,,28037,Franklin,
5805,7295000,"BUFFALO RIVER NR WOODVILLE, MS",466.5798,8,31.22694444,-91.29555556,MS,1,yes,,,,28157,Wilkinson,
5813,7299670,"Groesbeck Ck at SH 6 nr Quanah, TX",828.3573,11,34.35451979,-99.74037187,TX,1,yes,,yes,yes,48197,Hardeman,
5819,7301410,"Sweetwater Ck nr Kelton, TX",769.6656,11,35.47310419,-100.1209501,TX,3,yes,,yes,,48483,Wheeler,
5822,7301500,"North Fork Red River near Carter, OK",6885.075,11,35.1681083,-99.5073128,OK,1,yes,,,,40009,Beckham,
5850,7315200,"E Fk Little Wichita Rv nr Henrietta, TX",501.6159,11,33.81287833,-98.08504064,TX,1,yes,,yes,yes,48077,Clay,
5851,7315700,"Mud Creek near Courtney, OK",1488.686,11,34.00426528,-97.566968,OK,1,yes,,,,40067,Jefferson,
5891,7335700,"Kiamichi River near Big Cedar, OK",102.5696,11,34.63843694,-94.6127236,OK,3,yes,yes,yes,,40079,Le Flore,
5901,7340300,"Cossatot River near Vandervoort, AR",230.4347,11,34.37955418,-94.235763,AR,1,yes,,yes,yes,5113,Polk,
5919,7346045,"Black Cypress Bayou at Jefferson, TX",959.8869,11,32.77791731,-94.3574153,TX,1,yes,,,,48315,Marion,
5943,7359610,"Caddo River near Caddo Gap, AR",342.2349,8,34.38278,-93.60611,AR,1,yes,,,yes,5097,Montgomery,
5952,7362100,"SMACKOVER CREEK NEAR SMACKOVER, ARK.",996.0786,8,33.37595623,-92.77710581,AR,1,yes,,,yes,5103,Ouachita,
5954,7362587,"Alum Fork Saline River near Reform, AR",69.7725,8,34.797591,-92.933507,AR,1,yes,,,yes,5125,Saline,
5984,7373000,"Big Creek at Pollock, LA",131.1775,8,31.5362873,-92.40847139,LA,1,yes,,yes,yes,22043,Grant,
5986,7375000,"Tchefuncta River near Folsom, LA",249.3477,8,30.61602231,-90.24869545,LA,1,yes,,,yes,22105,Tangipahoa,
