8893,14182500,"LITTLE NORTH SANTIAM RIVER NEAR MEHAMA, OR",286.8498,17,44.79151084,-122.5789739,OR,1,yes,,,,41047,Marion,
8896,14185000,"SOUTH SANTIAM RIVER BELOW CASCADIA, OR",458.1774,17,44.39179225,-122.4975817,OR,3,yes,,yes,,41043,Linn,
8897,14185900,"QUARTZVILLE CREEK NEAR CASCADIA, OREG.",258.1965,17,44.54012357,-122.4359155,OR,1,yes,,yes,,41043,Linn,
8898,14187000,"WILEY CREEK NEAR FOSTER, OR",134.7498,17,44.37234769,-122.6231384,OR,1,yes,,,,41043,Linn,
8949,14216500,"MUDDY CREEK BELOW CLEAR CREEK NEAR COUGAR, WA",349.524,17,46.07566882,-121.9986982,WA,1,yes,,,,53059,Skamania,
8953,14222500,"EAST FORK LEWIS RIVER NEAR HEISSON, WA",323.8893,17,45.83678093,-122.4662083,WA,3,yes,,yes,yes,53011,Clark,
8962,14236200,"TILTON RIVER AB BEAR CANYON CREEK NEAR CINEBAR, WA",360.9936,17,46.59538432,-122.4595564,WA,1,yes,,,,53041,Lewis,
8977,14301000,"NEHALEM RIVER NEAR FOSS, OR",1743.544,17,45.70399863,-123.755405,OR,1,yes,,yes,,41057,Tillamook,
8981,14303200,"TUCCA CREEK NEAR BLAINE, OR.",8.0595,17,45.32427635,-123.5465012,OR,1,yes,,,,41057,Tillamook,
8983,14305500,"SILETZ RIVER AT SILETZ, OR",526.3299,17,44.71511723,-123.8873348,OR,1,yes,,,,41041,Lincoln,
8985,14306340,"EAST FORK LOBSTER CREEK NEAR ALSEA, OR.",14.7276,17,44.24789909,-123.6364936,OR,1,yes,,,,41039,Lane,
8987,14306500,"ALSEA RIVER NEAR TIDEWATER, OR",857.1636,17,44.38595381,-123.831778,OR,1,yes,,yes,,41041,Lincoln,
8993,14308990,"COW CREEK ABV GALESVILLE RES, NR AZALEA, OR.",167.7555,17,42.82317665,-123.1258922,OR,1,yes,,,,41019,Douglas,
8995,14309500,"WEST FORK COW CREEK NEAR GLENDALE, OR",224.9208,17,42.80400356,-123.6109071,OR,1,yes,,,,41019,Douglas,
9013,14316700,"STEAMBOAT CREEK NEAR GLIDE, OR",587.8989,17,43.34984202,-122.7289415,OR,1,yes,,yes,,41019,Douglas,
9023,14325000,"SOUTH FORK COQUILLE RIVER AT POWERS, OR",443.0745,17,42.89149904,-124.0706521,OR,1,yes,,yes,yes,41011,Coos,
9047,14362250,"STAR GULCH NEAR RUCH, OR.",41.4216,17,42.15401355,-123.075323,OR,1,yes,,,,41029,Jackson,
9057,14400000,"CHETCO RIVER NEAR BROOKINGS, OR",702.6345,17,42.12344278,-124.1873107,OR,1,yes,,yes,,41015,Curry,
