5991,7376000,"Tickfaw River at Holden, LA",651.6053,8,30.50380161,-90.67731629,LA,3,yes,,,,22063,Livingston,
5993,7377000,"Amite River near Darlington, LA",1525.312,8,30.88906941,-90.84454541,LA,1,yes,,,,22091,St Helena,
6009,8013000,"CALCASIEU RIVER NR GLENMORA, LA",1293.693,8,30.99602322,-92.67375497,LA,1,yes,,yes,yes,22079,Rapides,
6011,8014500,"Whiskey Chitto Creek Near Oberlin, LA",1305.147,8,30.69875,-92.89319444,LA,4,yes,,,,22003,Allen,acad
6031,8023080,"Bayou Grand Cane near Stanley, LA",187.6086,12,31.97933309,-93.9340773,LA,1,yes,,,,22031,De Soto,
6035,8025500,"Bayou Toro near Toro, LA",383.0247,12,31.30712737,-93.51572947,LA,1,yes,,yes,yes,22085,Sabine,
6040,8029500,"Big Cow Ck nr Newton, TX",333.3996,12,30.81888889,-93.78555556,TX,1,yes,,yes,,48351,Newton,
6083,8050800,"Timber Ck nr Collinsville, TX",100.9324,12,33.55455428,-96.94722668,TX,4,yes,,,,48097,Cooke,trin
6132,8066200,"Long King Ck at Livingston, TX",364.1202,12,30.716306,-94.95882373,TX,3,yes,,yes,yes,48373,Polk,
6134,8066300,"Menard Ck nr Rye, TX",383.5714,12,30.48138889,-94.77972222,TX,4,yes,,,,48291,Liberty,trin
6153,8070000,"E Fk San Jacinto Rv nr Cleveland, TX",841.0554,12,30.33659809,-95.10409994,TX,3,yes,,yes,yes,48291,Liberty,
6154,8070200,"E Fk San Jacinto Rv nr New Caney, TX",989.3655,12,30.1454932,-95.12437563,TX,1,yes,,,,48201,Harris,
6185,8079600,"DMF Brazos Rv at Justiceburg, TX",3348.947,12,33.03843236,-101.1976302,TX,1,yes,,,,48169,Garza,
6195,8082700,"Millers Ck nr Munday, TX",276.0354,12,33.32926607,-99.46508251,TX,1,yes,,yes,,48447,Throckmorton,
6206,8086212,"Hubbard Ck bl Albany, TX",1584.818,12,32.73289717,-99.14062992,TX,1,yes,,yes,yes,48417,Shackelford,
6207,8086290,"Big Sandy Ck abv Breckenridge, TX",732.9825,12,32.64845613,-99.00451456,TX,1,yes,,,,48429,Stephens,
6231,8101000,"Cowhouse Ck at Pidcoke, TX",1177.1,12,31.28489022,-97.88502445,TX,3,yes,,yes,,48099,Coryell,
6234,8103900,"S Fk Rocky Ck nr Briggs, TX",86.00084,12,30.91156805,-98.0369676,TX,1,yes,,yes,,48053,Burnet,
6240,8104900,"S Fk San Gabriel Rv at Georgetown, TX",342.6174,12,30.6257499,-97.69112037,TX,1,yes,,yes,,48491,Williamson,
6247,8109700,"Middle Yegua Ck nr Dime Box, TX",610.1262,12,30.33937764,-96.90470373,TX,1,yes,,yes,yes,48287,Lee,
6300,8150800,"Beaver Ck nr Mason, TX",557.5212,12,30.64351548,-99.09588478,TX,1,yes,,yes,yes,48319,Mason,
6306,8155200,"Barton Ck at SH 71 nr Oak Hill, TX",232.7427,12,30.29631587,-97.925565,TX,1,yes,,,,48453,Travis,
6322,8158700,"Onion Ck nr Driftwood, TX",320.3442,12,30.08298924,-98.00778589,TX,1,yes,,,,48209,Hays,
6323,8158810,"Bear Ck bl FM 1826 nr Driftwood, TX",31.7889,12,30.15548749,-97.94000762,TX,1,yes,,,,48209,Hays,
6336,8164000,"Lavaca Rv nr Edna, TX",2123.997,12,28.95998449,-96.6863668,TX,1,yes,,yes,,48239,Jackson,
6337,8164300,"Navidad Rv nr Hallettsville, TX",861.5421,12,29.46690801,-96.81275597,TX,1,yes,,yes,yes,48285,Lavaca,
6343,8164600,"Garcitas Ck nr Inez, TX",253.9206,12,28.89137591,-96.81914857,TX,1,yes,,,yes,48469,Victoria,
6345,8165300,"N Fk Guadalupe Rv nr Hunt, TX",435.9924,12,30.06409747,-99.38699162,TX,1,yes,,yes,,48265,Kerr,
6361,8171300,"Blanco Rv nr Kyle, TX",1067.474,12,29.97938297,-97.91000511,TX,1,yes,,yes,,48209,Hays,
6367,8175000,"Sandies Ck nr Westhoff, TX",1421.657,12,29.2152475,-97.44943529,TX,3,yes,,yes,,48123,De Witt,
6370,8176900,"Coleto Ck at Arnold Rd nr Schroeder, TX",925.4421,12,28.86165308,-97.2263791,TX,1,yes,,,yes,48175,Goliad,
6379,8178880,"Medina Rv at Bandera, TX",850.5792,12,29.72383537,-99.07003496,TX,1,yes,,,,48019,Bandera,
6405,8189500,"Mission Rv at Refugio, TX",1808.286,12,28.29195088,-97.27915932,TX,1,yes,,yes,,48391,Refugio,
6408,8190000,"Nueces Rv at Laguna, TX",1961.433,12,29.42856679,-99.9972871,TX,4,yes,,yes,,48463,Uvalde,sctx
6409,8190500,"W Nueces Rv nr Brackettville, TX",1799.09,12,29.47273118,-100.2364633,TX,3,yes,,yes,,48271,Kinney,
6413,8194200,"San Casimiro Ck nr Freer, TX",1220.584,12,27.96501329,-98.96696778,TX,1,yes,,yes,yes,48479,Webb,
6415,8195000,"Frio Rv at Concan, TX",1028.286,12,29.48856496,-99.70477562,TX,4,yes,,yes,yes,48463,Uvalde,sctx
6416,8196000,"Dry Frio Rv nr Reagan Wells, TX",326.9781,12,29.50467576,-99.78144517,TX,1,yes,,yes,,48463,Uvalde,
6419,8198500,"Sabinal Rv at Sabinal, TX",624.347,12,29.31430556,-99.4804722,TX,1,yes,,yes,,48463,Uvalde,
6420,8200000,"Hondo Ck nr Tarpley, TX",249.1146,12,29.56967272,-99.24670636,TX,1,yes,,,,48325,Medina,
6425,8202700,"Seco Ck at Rowe Ranch nr D'Hanis, TX",434.745,12,29.37078917,-99.28781853,TX,3,yes,,yes,,48325,Medina,
6484,8267500,"RIO HONDO NEAR VALDEZ, NM",96.2577,13,36.54169317,-105.5563978,NM,1,yes,,yes,,35055,Taos,
6487,8269000,"RIO PUEBLO DE TAOS NEAR TAOS, NM",163.2663,13,36.43947243,-105.5036203,NM,1,yes,,yes,,35055,Taos,
6488,8271000,"RIO LUCERO NEAR ARROYO SECO, NM",43.7742,13,36.50836055,-105.5308423,NM,1,yes,,yes,,35055,Taos,
6521,8324000,"JEMEZ RIVER NEAR JEMEZ, NM",1207.948,13,35.66169371,-106.743369,NM,4,yes,,yes,,35043,Sandoval,riog
6548,8377900,"RIO MORA NEAR TERRERO, NM",139.0311,13,35.77725369,-105.6580725,NM,1,yes,yes,yes,yes,35047,San Miguel,
6549,8378500,"PECOS RIVER NEAR PECOS, NM",444.9591,13,35.70836606,-105.6825171,NM,1,yes,,yes,,35047,San Miguel,
6551,8380500,"GALLINAS CREEK NEAR MONTEZUMA, NM",198.0621,13,35.65198595,-105.3188997,NM,1,yes,,yes,,35047,San Miguel,
6608,9034900,"BOBTAIL CREEK NEAR JONES PASS, CO.",15.6492,14,39.76026447,-105.9064014,CO,1,yes,,,,8049,Grand,
6611,9035800,"DARLING CREEK NEAR LEAL, CO.",22.9437,14,39.80054181,-106.0264066,CO,1,yes,,,,8049,Grand,
6612,9035900,"SOUTH FORK OF WILLIAMS FORK NEAR LEAL, CO.",72.8421,14,39.79581958,-106.0305734,CO,4,yes,,,,8049,Grand,ucol
6624,9047700,"KEYSTONE GULCH NEAR DILLON, CO.",23.5701,14,39.59443117,-105.9725158,CO,1,yes,,,,8117,Summit,
6650,9065500,"GORE CREEK AT UPPER STATION, NEAR MINTURN, CO.",37.7757,14,39.6258193,-106.2780823,CO,1,yes,,,,8037,Eagle,
6651,9066000,"BLACK GORE CREEK NEAR MINTURN, CO.",32.4099,14,39.59637495,-106.2650264,CO,1,yes,,,,8037,Eagle,
6654,9066200,"BOOTH CREEK NEAR MINTURN, CO.",16.0965,14,39.64831927,-106.3230833,CO,1,yes,,,,8037,Eagle,
6655,9066300,"MIDDLE CREEK NEAR MINTURN, CO.",15.5223,14,39.64581933,-106.3822512,CO,1,yes,,,,8037,Eagle,
6678,9081600,"CRYSTAL RIVER AB AVALANCHE C, NEAR REDSTONE, CO.",432.8928,14,39.23220666,-107.2272726,CO,1,yes,,yes,yes,8097,Pitkin,
6692,9107000,"TAYLOR RIVER AT TAYLOR PARK, CO.",331.6194,14,38.86027127,-106.5666966,CO,1,yes,,,,8051,Gunnison,
6747,9183500,"MILL CREEK AT SHELEY TUNNEL, NEAR MOAB, UT.",74.3022,14,38.4830403,-109.4040043,UT,1,yes,,,yes,49037,San Juan,
6767,9210500,"FONTENELLE C NR HERSCHLER RANCH, NR FONTENELLE, WY",398.3094,14,42.09605297,-110.4165559,WY,1,yes,,yes,yes,56023,Lincoln,
6781,9223000,"HAMS FORK BELOW POLE CREEK, NEAR FRONTIER, WY",333.153,14,42.11049394,-110.7096212,WY,1,yes,,yes,,56023,Lincoln,
6873,9306242,"CORRAL GULCH NEAR RANGELY, CO.",81.9855,14,39.92025021,-108.4728719,CO,1,yes,,,yes,8103,Rio Blanco,
6883,9312600,"WHITE RIVER BL TABBYUNE C NEAR SOLDIER SUMMIT, UT",195.2946,14,39.87579282,-111.0373878,UT,1,yes,,,,49049,Utah,
6917,9352900,"VALLECITO CREEK NEAR BAYFIELD, CO.",188.1514,14,37.47750126,-107.5436688,CO,3,yes,yes,yes,yes,8067,La Plata,
6950,9378170,"SOUTH CREEK ABOVE RESERVOIR NEAR MONTICELLO, UT",21.8979,14,37.84666083,-109.3695625,UT,1,yes,,,,49037,San Juan,
6951,9378630,"RECAPTURE CREEK NEAR BLANDING, UT",10.4238,14,37.75555042,-109.476511,UT,1,yes,,,,49037,San Juan,
6967,9386900,"RIO NUTRIA NEAR RAMAH, NM",184.9419,15,35.28252877,-108.5534109,NM,1,yes,,,yes,35031,Mckinley,
6994,9404450,"EAST FORK VIRGIN RIVER NEAR GLENDALE, UT",192.96,15,37.33942723,-112.6043769,UT,1,yes,,yes,yes,49025,Kane,
7032,9423350,CARUTHERS C NR IVANPAH CA,2.2428,15,35.244989,-115.298876,CA,1,yes,,,,6071,San Bernardino,
7038,9430500,"GILA RIVER NEAR GILA, NM",4804.927,15,33.06117891,-108.5372751,NM,1,yes,,yes,,35017,Grant,
7039,9430600,"MOGOLLON CREEK NEAR CLIFF, NM",190.522,15,33.1667329,-108.6497786,NM,1,yes,yes,yes,yes,35017,Grant,
7051,9447800,"BONITA CREEK NEAR MORENCI, AZ.",781.9614,15,32.95561778,-109.5311876,AZ,1,yes,,,yes,4009,Graham,
7067,9480000,"SANTA CRUZ RIVER NEAR LOCHIEL, AZ.",213.381,15,31.35537817,-110.5895264,AZ,3,yes,,yes,,4023,Santa Cruz,
7070,9484000,"SABINO CREEK NEAR TUCSON, AZ.",103.6521,15,32.3167422,-110.8103674,AZ,1,yes,,,,4019,Pima,
7074,9484600,"PANTANO WASH NEAR VAIL, AZ.",1179.589,15,32.0359141,-110.6775818,AZ,1,yes,,,,4019,Pima,
7091,9492400,"EAST FORK WHITE RIVER NEAR FORT APACHE, AZ.",128.9673,15,33.8222723,-109.8145413,AZ,3,yes,,,,4001,Apache,
7092,9494000,"WHITE RIVER NEAR FORT APACHE, AZ.",1628.228,15,33.73644059,-110.1667671,AZ,1,yes,,,,4007,Gila,
7097,9497800,"CIBECUE CREEK NEAR CHYSOTILE, AZ.",750.8628,15,33.84310532,-110.5576092,AZ,1,yes,,,yes,4007,Gila,
7098,9497980,"CHERRY CREEK NEAR GLOBE, AZ.",516.798,15,33.8278262,-110.8562266,AZ,1,yes,,,,4007,Gila,
7115,9505200,"WET BEAVER CREEK NEAR RIMROCK, AZ.",285.6771,15,34.67474409,-111.672094,AZ,1,yes,,,,4025,Yavapai,
7118,9505350,"DRY BEAVER CREEK NEAR RIMROCK, AZ.",365.6619,15,34.72863146,-111.775708,AZ,1,yes,,,,4025,Yavapai,
7120,9505800,"WEST CLEAR CREEK NEAR CAMP VERDE, AZ.",614.9414,15,34.53863606,-111.6940356,AZ,4,yes,,,,4025,Yavapai,cazb
7123,9508300,"WET BOTTOM CREEK NEAR CHILDS, AZ.",93.0006,15,34.16086787,-111.6929235,AZ,3,yes,yes,yes,,4007,Gila,
7127,9510200,"SYCAMORE CREEK NEAR FORT MCDOWELL, AZ.",425.3085,15,33.69421054,-111.541802,AZ,1,yes,,,,4013,Maricopa,
7132,9512280,"CAVE CREEK BLW COTTONWOOD CR NEAR CAVE CREEK, AZ.",188.7093,15,33.88725977,-111.9540388,AZ,1,yes,,,yes,4013,Maricopa,
7138,9513780,"NEW RIVER NEAR ROCK SPRINGS, AZ.",177.4701,15,33.97420168,-112.0990458,AZ,1,yes,,,,4013,Maricopa,
7146,9535100,"SAN SIMON WASH NEAR PISINIMO, AZ.",1482.933,15,32.04423703,-112.3709706,AZ,1,yes,,,,4019,Pima,
7158,10023000,"BIG CREEK NEAR RANDOLPH, UT",131.4567,16,41.60994177,-111.2540876,UT,1,yes,,,,49033,Rich,
7179,10109001,COM F LOGAN R AB ST D AND LO HP AND SM C N LO UT,555.5961,16,41.74437546,-111.7843867,UT,1,yes,,,,49005,Cache,
7227,10166430,"WEST CANYON CREEK NEAR CEDAR FORT, UT",70.173,16,40.40522565,-112.1004959,UT,1,yes,,,yes,49049,Utah,
7232,10172200,"RED BUTTE CREEK AT FORT DOUGLAS, NEAR SLC, UT",18.68708,16,40.77994627,-111.806045,UT,4,yes,yes,yes,yes,49035,Salt Lake,grsl
7233,10172700,"VERNON CREEK NEAR VERNON, UT",69.92911,16,39.97939105,-112.3802297,UT,1,yes,,yes,yes,49045,Tooele,
7234,10172800,"SOUTH WILLOW CREEK NEAR GRANTSVILLE, UT",11.0709,16,40.49633109,-112.5744028,UT,1,yes,,,,49045,Tooele,
7239,10173450,"MAMMOTH CREEK ABV WEST HATCH DITCH, NEAR HATCH, UT",268.5276,16,37.62275721,-112.5168773,UT,1,yes,,,,49017,Garfield,
7249,10205030,"SALINA CREEK NEAR EMERY, UT",134.5977,16,38.911914,-111.530465,UT,1,yes,,yes,yes,49041,Sevier,
7263,10234500,"BEAVER RIVER NEAR BEAVER, UT",236.4192,16,38.28052642,-112.5682713,UT,1,yes,,yes,yes,49001,Beaver,
7269,10242000,"COAL CREEK NEAR CEDAR CITY, UT",208.6857,16,37.67219924,-113.0346702,UT,1,yes,,,,49021,Iron,
7272,10244950,"STEPTOE C NR ELY, NV",28.1961,16,39.20153889,-114.6891611,NV,1,yes,,yes,,32033,White Pine,
7279,10249300,"S TWIN R NR ROUND MOUNTAIN, NV",50.1957,16,38.88743023,-117.2453673,NV,1,yes,yes,yes,yes,32023,Nye,
7294,10258000,TAHQUITZ C NR PALM SPRINGS CA,43.6914,18,33.80501929,-116.5591816,CA,1,yes,,yes,,6065,Riverside,
7295,10258500,PALM CYN C NR PALM SPRINGS CA,241.5123,18,33.74502178,-116.5355709,CA,1,yes,,yes,yes,6065,Riverside,
7296,10259000,ANDREAS C NR PALM SPRINGS CA,22.4568,18,33.76002112,-116.5500155,CA,1,yes,,yes,,6065,Riverside,
7298,10259200,DEEP C NR PALM DESERT CA,79.1235,18,33.63113647,-116.3922342,CA,1,yes,,,,6065,Riverside,
7307,10263500,BIG ROCK C NR VALYERMO CA,59.4639,18,34.42083115,-117.8395072,CA,1,yes,,yes,yes,6037,Los Angeles,
7348,10308200,E F CARSON R BL MARKLEEVILLE C NR MARKLEEVILLECA,716.4228,16,38.71462743,-119.7648985,CA,4,yes,,yes,,6003,Alpine,nvbr
7360,10310500,"CLEAR CREEK NEAR CARSON CITY, NV",39.4893,16,39.11324216,-119.7982365,NV,1,yes,,,,32005,Douglas,
7374,10316500,"LAMOILLE C NR LAMOILLE, NV",64.7784,16,40.69076057,-115.477003,NV,1,yes,,yes,,32007,Elko,
7395,10329500,"MARTIN C NR PARADISE VALLEY, NV",454.5207,16,41.53461752,-117.4179047,NV,1,yes,,yes,yes,32013,Humboldt,
7404,10336645,GENERAL C NR MEEKS BAY CA,19.5984,16,39.05185197,-120.1185209,CA,1,yes,,,,6017,El Dorado,
7405,10336660,BLACKWOOD C NR TAHOE CITY CA,29.7963,16,39.10740708,-120.1621352,CA,1,yes,,yes,,6061,Placer,
7407,10336676,WARD C AT HWY 89 NR TAHOE PINES CA,24.7167,16,39.13212922,-120.1576913,CA,1,yes,,,,6061,Placer,
7413,10336740,"Logan House Ck nr Glenbrook, NV",5.5368,16,39.06657478,-119.9354605,NV,1,yes,,,,32005,Douglas,
7428,10343500,SAGEHEN C NR TRUCKEE CA,27.6027,16,39.43157246,-120.2379793,CA,1,yes,yes,yes,yes,6057,Nevada,
7438,10348850,GALENA C AT GALENA C STATE PARK,19.1385,16,39.35435414,-119.8585225,NV,1,yes,,,,32031,Washoe,
7471,10396000,DONNER UND BLITZEN RIVER NR FRENCHGLEN OR,528.894,17,42.79083333,-118.8675,OR,3,yes,,yes,yes,41025,Harney,
7477,11015000,SWEETWATER R NR DESCANSO CA,117.7605,18,32.83477372,-116.6230747,CA,1,yes,,,,6073,San Diego,
7584,11098000,ARROYO SECO NR PASADENA CA,41.5665,18,34.22222629,-118.1775727,CA,1,yes,,yes,yes,6037,Los Angeles,
7635,11124500,SANTA CRUZ C NR SANTA YNEZ CA,191.5227,18,34.59665633,-119.9087519,CA,1,yes,,yes,,6083,Santa Barbara,
7662,11141280,LOPEZ C NR ARROYO GRANDE CA,54.0072,18,35.23553035,-120.4723857,CA,1,yes,,yes,,6079,San Luis Obispo,
7665,11143000,BIG SUR R NR BIG SUR CA,120.6126,18,36.24579648,-121.7732872,CA,1,yes,,yes,,6053,Monterey,
7675,11148900,NACIMIENTO R BL SAPAQUE C NR BRYSON CA,403.4547,18,35.78857918,-121.0938048,CA,1,yes,,,,6079,San Luis Obispo,
7679,11151300,SAN LORENZO C BL BITTERWATER C NR KING CITY CA,608.2281,18,36.26802087,-121.066303,CA,3,yes,,yes,yes,6053,Monterey,
7710,11162500,PESCADERO C NR PESCADERO CA,118.8711,18,37.26077707,-122.3288603,CA,1,yes,,yes,yes,6081,San Mateo,
7735,11176400,ARROYO VALLE BL LANG CN NR LIVERMORE CA,338.5611,18,37.56132196,-121.6838389,CA,1,yes,,yes,,6001,Alameda,
7741,11180500,DRY C A UNION CITY CA,24.3189,18,37.6060452,-122.0238504,CA,1,yes,,,,6001,Alameda,
7745,11180960,CULL C AB CULL C RES NR CASTRO VALLEY CA,15.0624,18,37.71770737,-122.0544067,CA,1,yes,,,,6001,Alameda,
7799,11224500,LOS GATOS C AB NUNEZ CYN NR COALINGA CA,247.4352,18,36.21467719,-120.4707116,CA,1,yes,,yes,yes,6019,Fresno,
7804,11230500,BEAR C NR LAKE THOMAS A EDISON CA,135.5301,18,37.33938634,-118.9734513,CA,1,yes,,yes,,6019,Fresno,
7810,11237500,PITMAN C BL TAMARACK C CA,59.8239,18,37.19855659,-119.2137328,CA,1,yes,,yes,,6019,Fresno,
7823,11253310,CANTUA C NR CANTUA CREEK CA,120.4371,18,36.40217399,-120.4334917,CA,1,yes,,yes,,6019,Fresno,
7832,11264500,MERCED R A HAPPY ISLES BRIDGE NR YOSEMITE CA,467.9761,18,37.73159272,-119.5587736,CA,4,yes,yes,yes,yes,6043,Mariposa,sanj
7833,11266500,MERCED R A POHONO BRIDGE NR YOSEMITE CA,833.0817,18,37.71687138,-119.6662788,CA,4,yes,,yes,,6043,Mariposa,sanj
7842,11274500,ORESTIMBA C NR NEWMAN CA,347.7503,18,37.31549247,-121.1252081,CA,4,yes,,yes,yes,6099,Stanislaus,sanj
7845,11274630,DEL PUERTO C NR PATTERSON CA,187.4375,18,37.48659935,-121.2091026,CA,4,yes,,,,6099,Stanislaus,sanj
7858,11284400,BIG C AB WHITES GULCH NR GROVELAND CA,41.7168,18,37.84187143,-120.1849103,CA,1,yes,,,,6109,Tuolumne,
7884,11299600,BLACK C NR COPPEROPOLIS CA,37.3239,18,37.96103615,-120.6152035,CA,1,yes,,,,6009,Calaveras,
7896,11315000,COLE C NR SALT SPRINGS DAM CA,54.0108,18,38.51907831,-120.2126928,CA,1,yes,,yes,,6005,Amador,
7967,11381500,MILL C NR LOS MOLINOS CA,337.6305,18,40.05460222,-122.0241542,CA,3,yes,,yes,,6103,Tehama,
7969,11383500,DEER C NR VINA CA,539.7753,18,40.01404745,-121.9483181,CA,4,yes,,yes,yes,6103,Tehama,
8049,11427700,DUNCAN CYN C NR FRENCH MEADOWS CA,25.5231,18,39.1357376,-120.4785353,CA,1,yes,,yes,,6061,Placer,sacr
8087,11451100,NF CACHE C A HOUGH SPRING NR CLEARLAKE OAKS CA,155.0943,18,39.16544583,-122.6199862,CA,1,yes,,yes,,6033,Lake,
8136,11468500,NOYO R NR FORT BRAGG CA,273.5145,18,39.42822378,-123.7377917,CA,1,yes,,yes,,6045,Mendocino,
8145,11473900,MF EEL R NR DOS RIOS CA,1925.013,18,39.70626687,-123.3252913,CA,3,yes,,yes,,6045,Mendocino,
8149,11475560,ELDER C NR BRANSCOMB CA,16.794,18,39.72959972,-123.6439073,CA,1,yes,yes,yes,,6045,Mendocino,
8153,11476600,BULL C NR WEOTT CA,71.8452,18,40.35125028,-124.0039312,CA,1,yes,,yes,,6023,Humboldt,
8155,11478500,VAN DUZEN R NR BRIDGEVILLE CA,572.3766,18,40.48041636,-123.8908761,CA,1,yes,,yes,,6023,Humboldt,
8156,11480390,MAD R AB RUTH RES NR FOREST GLEN CA,242.5977,18,40.28431329,-123.3353034,CA,1,yes,,,yes,6105,Trinity,
8160,11481200,LITTLE R NR TRINIDAD CA,105.4035,18,41.01095903,-124.0817333,CA,1,yes,,yes,,6023,Humboldt,
8162,11482500,REDWOOD C A ORICK CA,718.0398,18,41.2992896,-124.0511825,CA,1,yes,,yes,,6023,Humboldt,
8179,11522500,SALMON R A SOMES BAR CA,1943.12,18,41.37762652,-123.4775582,CA,3,yes,,yes,,6093,Siskiyou,
8181,11523200,TRINITY R AB COFFEE C NR TRINITY CTR CA,382.9356,18,41.1112571,-122.7055788,CA,1,yes,,yes,yes,6105,Trinity,
8194,11528700,SF TRINITY R BL HYAMPOM CA,1980.083,18,40.64986273,-123.4942046,CA,1,yes,,yes,,6105,Trinity,
8197,11532500,SMITH R NR CRESCENT CITY CA,1577.962,18,41.79150263,-124.0761887,CA,3,yes,,yes,yes,6015,Del Norte,
8198,12010000,"NASELLE RIVER NEAR NASELLE, WA",142.182,17,46.3739937,-123.743482,WA,1,yes,,yes,,53049,Pacific,
8200,12013500,"WILLAPA RIVER NEAR WILLAPA, WA",337.6854,17,46.65093418,-123.6526584,WA,1,yes,,yes,,53049,Pacific,
8202,12020000,"CHEHALIS RIVER NEAR DOTY, WA",294.2235,17,46.61732361,-123.277644,WA,1,yes,,yes,,53041,Lewis,
8206,12025000,"NEWAUKUM RIVER NEAR CHEHALIS, WA",404.9037,17,46.6201042,-122.945126,WA,1,yes,,,,53041,Lewis,
8207,12025700,"SKOOKUMCHUCK RIVER NEAR VAIL, WA",103.3029,17,46.77260276,-122.5940086,WA,1,yes,,,,53067,Thurston,
8214,12035000,"SATSOP RIVER NEAR SATSOP, WA",769.8996,17,47.0006512,-123.4948838,WA,1,yes,,yes,,53027,Grays Harbor,
8224,12040500,"QUEETS RIVER NEAR CLEARWATER, WA",1153.437,17,47.53785884,-124.3157457,WA,1,yes,,yes,,53031,Jefferson,
8225,12041200,"HOH RIVER AT US HIGHWAY 101 NEAR FORKS, WA",655.7967,17,47.80674726,-124.2510329,WA,1,yes,,,,53031,Jefferson,
8227,12043000,"CALAWAH RIVER NEAR FORKS, WA",337.185,17,47.96007697,-124.3929872,WA,1,yes,,,,53009,Clallam,
8231,12048000,"DUNGENESS RIVER NEAR SEQUIM, WA",405.0063,17,48.01425781,-123.1326773,WA,1,yes,,yes,,53009,Clallam,
8234,12054000,"DUCKABUSH RIVER NEAR BRINNON, WA",171.675,17,47.68398059,-123.0115511,WA,1,yes,,yes,,53031,Jefferson,
8235,12056500,"NF SKOKOMISH R BL STAIRCASE RPDS NR HOODSPORT, WA",146.9715,17,47.51425666,-123.3298868,WA,4,yes,,yes,,53045,Mason,
8244,12073500,"HUGE CREEK NEAR WAUNA, WA",15.6726,17,47.38926205,-122.6990242,WA,1,yes,,,yes,53053,Pierce,pugt
8250,12082500,"NISQUALLY RIVER NEAR NATIONAL, WA",349.9983,17,46.75260766,-122.0837194,WA,1,yes,,,,53053,Pierce,
8263,12092000,"PUYALLUP RIVER NEAR ELECTRON, WA",240.8814,17,46.90371641,-122.0351092,WA,1,yes,,,,53053,Pierce,
8266,12095000,"SOUTH PRAIRIE CREEK AT SOUTH PRAIRIE, WA",205.8354,17,47.13954628,-122.0926135,WA,1,yes,,,,53053,Pierce,
8292,12114500,"CEDAR RIVER BELOW BEAR CREEK NEAR CEDAR FALLS, WA",66.5559,17,47.34205417,-121.5489858,WA,1,yes,,,,53033,King,
8293,12115000,"CEDAR RIVER NEAR CEDAR FALLS, WA",102.7983,17,47.37010733,-121.6251009,WA,3,yes,,,,53033,King,
8294,12115500,"REX RIVER NEAR CEDAR FALLS, WA",34.7184,17,47.35066169,-121.6631582,WA,1,yes,,,,53033,King,
8298,12117000,"TAYLOR CREEK NEAR SELLECK, WA",44.85363,17,47.38649132,-121.8462217,WA,4,yes,,,,53033,King,
8320,12141300,"MIDDLE FORK SNOQUALMIE RIVER NEAR TANNER, WA",401.5098,17,47.48593975,-121.6478809,WA,1,yes,,,,53033,King,pugt
8323,12143600,"SF SNOQUALMIE RIVER AT EDGEWICK, WA",165.0069,17,47.45260396,-121.7178847,WA,1,yes,,,,53033,King,
8326,12144000,"SF SNOQUALMIE RIVER AT NORTH BEND, WA",210.1059,17,47.49288017,-121.7901109,WA,1,yes,,,,53033,King,
8328,12145500,"RAGING RIVER NEAR FALL CITY, WA",78.9804,17,47.53982388,-121.9090047,WA,1,yes,,,,53033,King,
8330,12147500,"NORTH FORK TOLT RIVER NEAR CARNATION, WA",102.8934,17,47.71232365,-121.7887272,WA,1,yes,,,,53033,King,
8331,12147600,"SOUTH FORK TOLT RIVER NEAR INDEX, WA",14.1264,17,47.70677144,-121.6001069,WA,1,yes,,,,53033,King,
8344,12167000,"NF STILLAGUAMISH RIVER NEAR ARLINGTON, WA",683.7525,17,48.26149178,-122.0476407,WA,1,yes,,,,53061,Snohomish,
8346,12175500,"THUNDER CREEK NEAR NEWHALEM, WA",273.8205,17,48.67262872,-121.0728964,WA,1,yes,,,,53073,Whatcom,
8348,12178100,"NEWHALEM CREEK NEAR NEWHALEM, WA",69.6834,17,48.65595877,-121.2384563,WA,1,yes,,,,53073,Whatcom,
8353,12186000,"SAUK RIVER AB WHITECHUCK RIVER NEAR DARRINGTON, WA",398.4354,17,48.16872009,-121.4706723,WA,1,yes,,yes,,53061,Snohomish,
8354,12189500,"SAUK RIVER NEAR SAUK, WA",1855.317,17,48.42455859,-121.5684634,WA,1,yes,,yes,yes,53057,Skagit,
8422,12358500,Middle Fork Flathead River nr West Glacier MT,2939.194,17,48.49524417,-114.0101189,MT,4,yes,,yes,,30029,Flathead,
8433,12374250,Mill Cr ab Bassoo Cr nr Niarada MT,50.7897,17,47.82966417,-114.6976303,MT,1,yes,,,,30089,Sanders,nrok
8434,12375900,South Crow Creek near Ronan MT,19.7226,17,47.4916,-114.0267742,MT,1,yes,,,,30047,Lake,
8435,12377150,Mission Cr ab Reservoir nr ST Ignatius MT,32.1768,17,47.3229869,-113.9795475,MT,1,yes,,,,30047,Lake,
8436,12381400,South Fork Jocko River near Arlee MT,150.9471,17,47.1954864,-113.8506533,MT,3,yes,,,,30047,Lake,
8437,12383500,Big Knife Creek near Arlee MT,17.6706,17,47.14742806,-113.9742717,MT,1,yes,,,,30047,Lake,
8440,12388400,Revais Cr bl West Fork nr Dixon MT,60.8409,17,47.2663172,-114.4067864,MT,1,yes,,,,30089,Sanders,
8443,12390700,Prospect Creek at Thompson Falls MT,470.2338,17,47.5860461,-115.355153,MT,1,yes,,yes,,30089,Sanders,
8454,12411000,NF COEUR D ALENE R AB SHOSHONE CK NR PRICHARD ID,867.4833,17,47.70611111,-115.9791667,ID,4,yes,,yes,yes,16079,Shoshone,
8455,12413000,NF COEUR D ALENE RIVER AT ENAVILLE ID,2325.166,17,47.56888889,-116.2533333,ID,4,yes,,yes,,16079,Shoshone,nrok
8469,12414500,ST JOE RIVER AT CALDER ID,2678.972,17,47.27464004,-116.1890492,ID,4,yes,,yes,,16079,Shoshone,nrok
8489,12447390,"ANDREWS CREEK NEAR MAZAMA, WA",58.10103,17,48.82292454,-120.1459245,WA,1,yes,yes,yes,,53047,Okanogan,nrok
8495,12451000,"STEHEKIN RIVER AT STEHEKIN, WA",830.5974,17,48.32958017,-120.6917669,WA,3,yes,,yes,yes,53007,Chelan,
8520,12488500,"AMERICAN RIVER NEAR NILE, WA",205.1703,17,46.97761606,-121.168696,WA,1,yes,,yes,yes,53077,Yakima,
8535,13010065,SNAKE RIVER AB JACKSON LAKE AT FLAGG RANCH WY,1222.287,17,44.09888889,-110.6675,WY,1,yes,,,,56039,Teton,
8537,13011500,PACIFIC CREEK AT MORAN WY,404.0775,17,43.85027778,-110.5177778,WY,1,yes,,yes,,56039,Teton,
8538,13011900,BUFFALO FORK AB LAVA CREEK NR MORAN WY,851.8032,17,43.83805556,-110.4411111,WY,3,yes,,yes,,56039,Teton,
8545,13018300,"CACHE CREEK NEAR JACKSON, WY",27.90146,17,43.45215258,-110.7040913,WY,1,yes,yes,yes,yes,56039,Teton,
8549,13023000,GREYS RIVER AB RESERVOIR NR ALPINE WY,1161.929,17,43.14277778,-110.9766667,WY,1,yes,,yes,,56023,Lincoln,
8592,13083000,TRAPPER CREEK NR OAKLEY ID,133.1838,17,42.16583333,-113.9836111,ID,1,yes,,,,16031,Cassia,
8624,13161500,BRUNEAU RIVER AT ROWLAND NV,986.1309,17,41.93323682,-115.6745268,NV,1,yes,,yes,yes,32007,Elko,
8635,13185000,BOISE RIVER NR TWIN SPRINGS ID,2154.389,17,43.65944444,-115.7272222,ID,3,yes,,yes,,16015,Boise,
8654,13235000,SF PAYETTE RIVER AT LOWMAN ID,1163.229,17,44.08527778,-115.6222222,ID,3,yes,,yes,yes,16015,Boise,
8659,13240000,LAKE FORK PAYETTE RIVER AB JUMBO CR NR MCCALL ID,125.5698,17,44.91361111,-115.9972222,ID,1,yes,,yes,,16085,Valley,
8700,13310700,SF SALMON RIVER NR KRASSEL RANGER STATION ID,853.1325,17,44.9869444,-115.725,ID,1,yes,,,,16085,Valley,
8701,13313000,JOHNSON CREEK AT YELLOW PINE ID,561.9358,17,44.96166667,-115.5,ID,6,yes,,yes,yes,16085,Valley,
8715,13331500,"MINAM RIVER NEAR MINAM, OR",618.9291,17,45.61986694,-117.7265892,OR,1,yes,yes,yes,yes,41063,Wallowa,
8722,13337000,LOCHSA RIVER NR LOWELL ID,3053.417,17,46.15083333,-115.5872222,ID,1,yes,,yes,,16049,Idaho,
8724,13338500,SF CLEARWATER RIVER AT STITES ID,3027.002,17,46.08638889,-115.9766667,ID,3,yes,,yes,,16049,Idaho,
8726,13340000,CLEARWATER RIVER AT OROFINO ID,14268.92,17,46.47833333,-116.2575,ID,1,yes,,yes,,16035,Clearwater,
8728,13340600,NF CLEARWATER RIVER NR CANYON RANGER STATION ID,3354.622,17,46.84046563,-115.6207033,ID,1,yes,,yes,,16035,Clearwater,
8750,14020000,"UMATILLA RIVER ABOVE MEACHAM CREEK, NR GIBBON, OR",341.4267,17,45.71957668,-118.3232913,OR,1,yes,,yes,yes,41059,Umatilla,
8804,14092750,"SHITIKE CR, AT PETERS PASTURE, NR WARM SPRINGS, OR",57.4803,17,44.75039516,-121.6333971,OR,1,yes,,,yes,41031,Jefferson,
8809,14096850,"BEAVER CREEK, BLW QUARTZ CR, NR SIMNASHO, OR.",374.6232,17,44.95872724,-121.3942286,OR,1,yes,,,,41065,Wasco,
8828,14137000,"SANDY RIVER NEAR MARMOT, OR",674.2395,17,45.39956422,-122.1373068,OR,3,yes,,yes,yes,41005,Clackamas,
8831,14138800,"BLAZED ALDER CREEK NEAR RHODODENDRON, OREG.",21.2886,17,45.45261834,-121.8914684,OR,1,yes,,,,41005,Clackamas,
8833,14138870,"FIR CREEK NEAR BRIGHTWOOD, OR",14.02431,17,45.48011889,-122.0256385,OR,4,yes,,,,41051,Multnomah,
8834,14138900,"NORTH FORK BULL RUN RIVER NEAR MULTNOMAH FALLS, OR",21.6828,17,45.49428561,-122.0359167,OR,1,yes,,,,41051,Multnomah,will
8836,14139800,"SOUTH FORK BULL RUN RIVER NEAR BULL RUN, OR",40.7034,17,45.44456402,-122.1095292,OR,1,yes,,,,41005,Clackamas,
8839,14141500,"LITTLE SANDY RIVER NEAR BULL RUN, OREG.",59.8653,17,45.41539777,-122.1714746,OR,1,yes,,,,41005,Clackamas,
8856,14154500,"ROW RIVER ABOVE PITCHER CREEK NEAR, DORENA, OREG",546.8105,17,43.7359565,-122.8734019,OR,4,yes,,yes,,41039,Lane,
8860,14158500,"MCKENZIE RIVER AT OUTLET OF CLEAR LAKE, OR",237.0771,17,44.36095451,-121.9956172,OR,1,yes,,,,41043,Linn,will
8861,14158790,"SMITH R AB SMITH R RES NR BELKNAP SPRGS,OREG.",40.5711,17,44.3345666,-122.0470074,OR,1,yes,,,,41043,Linn,
8879,14166500,"LONG TOM RIVER NEAR NOTI, OREG.",226.5246,17,44.04984478,-123.4262097,OR,3,yes,,,,41039,Lane,
